<?xml version="1.0"?>
<!DOCTYPE vpcconfiguration SYSTEM "cmx.dtd">
<vpcconfiguration>
 <resultfile name=""/>
 <measurefile name=""/>

 <resources>
  <component name="Component1" type="threaded" scheduler="RoundRobin">
   <attribute type="timeslice" value="20ns"/>
  </component>

  <component name="ZeroCom" type="threaded" scheduler="FCFS"></component>
 </resources>

 <mappings>
  <mapping source="sqrroot.a1" target="Component1">
    <attribute type="delay" value="100"/>
    <attribute type="Src::src" value="100"/>
  </mapping>

  <mapping source="sqrroot.a2" target="Component1">
    <attribute type="delay" value="100"/>
    <attribute type="SqrLoop::copyStore"  value="100"/>
    <attribute type="SqrLoop::copyInput"  value="100"/>
    <attribute type="SqrLoop::copyApprox" value="100"/>
  </mapping>

  <mapping source="sqrroot.a3" target="Component1">
    <attribute type="delay" value="100"/>
    <attribute type="Approx::approx" value="100"/>
  </mapping>

  <mapping source="sqrroot.a4" target="Component1">
    <attribute type="delay" value="100"/>
    <attribute type="Dup::dup" value="100"/>
  </mapping>

  <mapping source="sqrroot.a5" target="Component1">
    <attribute type="delay" value="100"/>
    <attribute type="Sink::sink" value="100"/>
  </mapping>

  <mapping source="cf_sqrroot.a1_sqrroot.a2_1" target="ZeroCom">
    <timing delay="0"/>
  </mapping>

  <mapping source="cf_sqrroot.a2_sqrroot.a3_1" target="ZeroCom">
    <timing delay="0"/>
  </mapping>

  <mapping source="cf_sqrroot.a3_sqrroot.a4_1" target="ZeroCom">
    <timing delay="0"/>
  </mapping>

  <mapping source="cf_sqrroot.a4_sqrroot.a3_1" target="ZeroCom">
    <timing delay="0"/>
  </mapping>

  <mapping source="cf_sqrroot.a4_sqrroot.a2_1" target="ZeroCom">
    <timing delay="0"/>
  </mapping>

  <mapping source="cf_sqrroot.a2_sqrroot.a5_1" target="ZeroCom">
    <timing delay="0"/>
  </mapping>

 </mappings>
</vpcconfiguration>
