<?xml version="1.0"?>
<!DOCTYPE vpcconfiguration SYSTEM "cmx.dtd">
<vpcconfiguration>
 <resultfile name=""/>
 <measurefile name=""/>

 <resources>
  <component name="Component1" type="threaded" scheduler="RoundRobin">
   <attribute type="timeslice" value="20ns"/>
  </component>
  <component name="FIFO" type="threaded" scheduler="RoundRobin">
   <attribute type="timeslice" value="20ns"/>
  </component>
 </resources>

 <mappings>
  <mapping source="sqrroot.a1" target="Component1">
    <timing dii="31" latency="33"/>
    <timing dii="13" latency="19" fname="Src::src"/>
  </mapping>

  <mapping source="sqrroot.a2" target="Component1">
    <timing dii="10" latency="100"/>
    <timing dii="10" latency="13" fname="SqrLoop::copyStore"/>
    <timing dii="7"  latency="17" fname="SqrLoop::copyInput"/>
    <timing dii="13" latency="19" fname="SqrLoop::copyApprox"/>
  </mapping>

  <mapping source="sqrroot.a3" target="Component1">
    <timing dii="100" latency="133"/>
    <timing dii="77"  latency="77" fname="Approx::approx"/>
  </mapping>

  <mapping source="sqrroot.a4" target="Component1">
    <timing dii="31" latency="33"/>
    <timing dii="11" latency="13" fname="Dup::dup"/>
  </mapping>

  <mapping source="sqrroot.a5" target="Component1">
    <timing dii="31" latency="33"/>
    <timing dii="13" latency="19" fname="Sink::sink"/>
  </mapping>

  <mapping source="sqrroot.smoc_fifo_0" target="FIFO">
    <timing dii="7" latency="37"/>
  </mapping>

  <mapping source="sqrroot.smoc_fifo_1" target="FIFO">
    <timing dii="11" latency="31"/>
  </mapping>

  <mapping source="sqrroot.smoc_fifo_2" target="FIFO">
    <timing dii="3" latency="42"/>
  </mapping>

  <mapping source="sqrroot.smoc_fifo_3" target="FIFO">
    <timing dii="2" latency="17"/>
  </mapping>

  <mapping source="sqrroot.smoc_fifo_4" target="FIFO">
    <timing dii="5" latency="55"/>
  </mapping>

  <mapping source="sqrroot.smoc_fifo_5" target="FIFO">
    <timing dii="1" latency="21"/>
  </mapping>

 </mappings>
</vpcconfiguration>
